{
  "schemaVersion": 2,
  "revision": 1,
  "select": {
    "priority": 0,
    "when": "false"
  },
  "presentation": {
    "title": "&d&lANIMATION LAB",
    "lines": [
      "{{ select(['&c', '&6', '&e', '&a', '&b', '&d'], floor(time.seconds * 4)) }}&lRAINBOW",
      "&b{{ marquee('MARQUEE', 7, floor(time.seconds * 4)) }}",
      "{{ timeline([['&aTIMELINE', 2], ['&eNEXT SCENE', 2]], time.seconds) }}",
      "&f{{ typewriter('TYPEWRITER', floor(time.seconds * 4) + 9, 1) }}",
      "{{ flash('&d&lFLASH', '&7FLASH', floor(time.seconds * 4)) }}",
      "&d{{ wipe('WIPE', floor(time.seconds * 4) + 4) }}",
      "{{ scanner('SCANNER', '&7', '&a', floor(time.seconds * 4)) }}",
      "&5{{ scramble('DECODE', floor(time.seconds * 4)) }}",
      "&6ODO {{ odometer(0, 999, mod(time.seconds, 10) / 10, 3) }}",
      "{{ wave('WAVE', ['&a', '&7'], floor(time.seconds * 4)) }}",
      "&d&kMAGIC&r",
      "&a{{ align('GLOSS', 20, 'left') }}",
      "&e{{ align('GLOSS', 20, 'center') }}",
      "&c{{ align('GLOSS', 20, 'right') }}"
    ],
    "hideNumbers": true
  },
  "variants": []
}
